15:25:50.352073 IP 10.196.108.178.ssh > 156.151.8.14.48339: Flags [P.], seq 2985263333:2985263397, ack 840942019, win 873, length 64
15:25:50.352155 IP 10.196.108.178.ssh > 156.151.8.14.48339: Flags [P.], seq 64:192, ack 1, win 873, length 128
15:25:50.352233 IP 10.196.108.178.ssh > 156.151.8.14.48339: Flags [P.], seq 192:256, ack 1, win 873, length 64
15:25:50.986487 IP 156.151.8.14.48339 > 10.196.108.178.ssh: Flags [P.], seq 1:49, ack 0, win 260, length 48
15:25:50.987462 IP 156.151.8.14.48339 > 10.196.108.178.ssh: Flags [.], ack 192, win 260, length 0
15:25:51.026223 IP 10.196.108.178.ssh > 156.151.8.14.48339: Flags [.], ack 49, win 873, length 0
15:25:51.038187 IP 156.151.8.14.48339 > 10.196.108.178.ssh: Flags [.], ack 256, win 259, length 0
15:25:52.487038 IP 10.196.108.178.ssh > 156.151.8.5.53089: Flags [P.], seq 2839652248:2839652328, ack 1899374030, win 452, length 80
15:25:53.091459 IP 156.151.8.9.63013 > 10.196.108.178.ssh: Flags [P.], seq 3137125631:3137125679, ack 1153402964, win 259, length 48
15:25:53.091484 IP 10.196.108.178.ssh > 156.151.8.9.63013: Flags [.], ack 48, win 363, length 0
15:25:53.097809 IP 156.151.8.5.53089 > 10.196.108.178.ssh: Flags [.], ack 80, win 32763, length 0
15:25:53.469326 IP 156.151.8.5.53089 > 10.196.108.178.ssh: Flags [P.], seq 1:49, ack 80, win 32763, length 48
15:25:53.469353 IP 10.196.108.178.ssh > 156.151.8.5.53089: Flags [.], ack 49, win 452, length 0
15:25:55.698404 IP 42.116.7.139.46855 > 10.196.108.178.ssh: Flags [S], seq 4251876335, win 14600, options [mss 1460,sackOK,TS val 1255403284 ecr 0,nop,wscale 7], length 0
15:25:55.698449 IP 10.196.108.178.ssh > 42.116.7.139.46855: Flags [S.], seq 1517853456, ack 4251876336, win 26844, options [mss 8960,sackOK,TS val 3448400294 ecr 1255403284,nop,wscale 7], length 0
15:25:55.992827 IP 42.116.7.139.46855 > 10.196.108.178.ssh: Flags [.], ack 1, win 115, options [nop,nop,TS val 1255403579 ecr 3448400294], length 0
15:25:55.993495 IP 42.116.7.139.46855 > 10.196.108.178.ssh: Flags [F.], seq 1, ack 1, win 115, options [nop,nop,TS val 1255403579 ecr 3448400294], length 0
15:25:55.994229 IP 10.196.108.178.ssh > 42.116.7.139.46855: Flags [.], ack 2, win 210, options [nop,nop,TS val 3448400590 ecr 1255403579], length 0
15:25:56.000818 IP 10.196.108.178.ssh > 42.116.7.139.46855: Flags [P.], seq 1:22, ack 2, win 210, options [nop,nop,TS val 3448400596 ecr 1255403579], length 21
15:25:56.001650 IP 10.196.108.178.ssh > 42.116.7.139.46855: Flags [F.], seq 22, ack 2, win 210, options [nop,nop,TS val 3448400597 ecr 1255403579], length 0
15:25:56.295145 IP 42.116.7.139.46855 > 10.196.108.178.ssh: Flags [R], seq 4251876337, win 0, length 0
15:25:56.295784 IP 42.116.7.139.46855 > 10.196.108.178.ssh: Flags [R], seq 4251876337, win 0, length 0
15:25:59.371395 IP 156.151.8.9.63013 > 10.196.108.178.ssh: Flags [P.], seq 48:112, ack 1, win 259, length 64
15:25:59.371413 IP 10.196.108.178.ssh > 156.151.8.9.63013: Flags [.], ack 112, win 363, length 0
15:25:59.371639 IP 10.196.108.178.ssh > 156.151.8.9.63013: Flags [P.], seq 1:65, ack 112, win 363, length 64
15:25:59.473837 IP 10.196.108.178.ssh > 156.151.8.8.42430: Flags [P.], seq 2262191425:2262191505, ack 3759544083, win 387, length 80
15:26:00.048112 IP 156.151.8.9.63013 > 10.196.108.178.ssh: Flags [.], ack 65, win 259, length 0
15:26:00.060204 IP 156.151.8.8.42430 > 10.196.108.178.ssh: Flags [.], ack 80, win 32763, length 0
15:26:00.468715 IP 156.151.8.8.42430 > 10.196.108.178.ssh: Flags [P.], seq 1:49, ack 80, win 32763, length 48
15:26:00.468737 IP 10.196.108.178.ssh > 156.151.8.8.42430: Flags [.], ack 49, win 387, length 0
15:26:00.527362 IP 156.151.8.9.63013 > 10.196.108.178.ssh: Flags [P.], seq 112:176, ack 65, win 259, length 64
15:26:00.527686 IP 10.196.108.178.ssh > 156.151.8.9.63013: Flags [P.], seq 65:129, ack 176, win 363, length 64
15:26:00.549121 IP 10.196.108.178.ssh > 156.151.8.9.63013: Flags [P.], seq 129:209, ack 176, win 363, length 80
15:26:00.955379 IP 156.151.8.9.63013 > 10.196.108.178.ssh: Flags [.], ack 209, win 258, length 0
15:26:00.955406 IP 10.196.108.178.ssh > 156.151.8.9.63013: Flags [P.], seq 209:385, ack 176, win 363, length 176
15:26:01.584403 IP 156.151.8.9.63013 > 10.196.108.178.ssh: Flags [.], ack 385, win 260, length 0
15:26:06.001709 IP 10.196.108.178.ssh > 156.151.8.14.48339: Flags [P.], seq 256:336, ack 49, win 873, length 80
15:26:06.407996 IP 156.151.8.14.48339 > 10.196.108.178.ssh: Flags [P.], seq 49:97, ack 336, win 259, length 48
15:26:06.408020 IP 10.196.108.178.ssh > 156.151.8.14.48339: Flags [.], ack 97, win 873, length 0
15:26:08.475195 IP 10.196.108.178.ssh > 156.151.8.5.53089: Flags [P.], seq 80:160, ack 49, win 452, length 80
15:26:08.945371 IP 156.151.8.5.53089 > 10.196.108.178.ssh: Flags [.], ack 160, win 32763, length 0
15:26:08.997809 IP 156.151.8.5.53089 > 10.196.108.178.ssh: Flags [P.], seq 49:97, ack 160, win 32763, length 48
15:26:08.997826 IP 10.196.108.178.ssh > 156.151.8.5.53089: Flags [.], ack 97, win 452, length 0
15:26:15.476291 IP 10.196.108.178.ssh > 156.151.8.8.42430: Flags [P.], seq 80:160, ack 49, win 387, length 80
15:26:15.551767 IP 10.196.108.178.ssh > 156.151.8.9.63013: Flags [P.], seq 385:465, ack 176, win 363, length 80
15:26:16.074887 IP 156.151.8.9.63013 > 10.196.108.178.ssh: Flags [P.], seq 176:224, ack 465, win 260, length 48
15:26:16.114220 IP 10.196.108.178.ssh > 156.151.8.9.63013: Flags [.], ack 224, win 363, length 0
15:26:16.136941 IP 156.151.8.8.42430 > 10.196.108.178.ssh: Flags [.], ack 160, win 32762, length 0
15:26:16.473543 IP 156.151.8.8.42430 > 10.196.108.178.ssh: Flags [P.], seq 49:97, ack 160, win 32762, length 48
15:26:16.473565 IP 10.196.108.178.ssh > 156.151.8.8.42430: Flags [.], ack 97, win 387, length 0
15:26:16.520909 IP 156.151.8.9.63013 > 10.196.108.178.ssh: Flags [P.], seq 224:304, ack 465, win 260, length 80
15:26:16.520933 IP 10.196.108.178.ssh > 156.151.8.9.63013: Flags [.], ack 304, win 363, length 0
15:26:16.521572 IP 10.196.108.178.ssh > 156.151.8.9.63013: Flags [P.], seq 465:545, ack 304, win 363, length 80
15:26:16.978141 IP 156.151.8.9.63013 > 10.196.108.178.ssh: Flags [.], ack 545, win 260, length 0
15:26:17.437891 IP 156.151.8.9.63013 > 10.196.108.178.ssh: Flags [P.], seq 304:368, ack 545, win 260, length 64
15:26:17.438556 IP 10.196.108.178.ssh > 156.151.8.9.63013: Flags [P.], seq 545:673, ack 368, win 363, length 128
15:26:18.177408 IP 156.151.8.9.63013 > 10.196.108.178.ssh: Flags [.], ack 673, win 259, length 0
15:26:20.782955 IP 156.151.8.14.48339 > 10.196.108.178.ssh: Flags [P.], seq 97:145, ack 336, win 259, length 48
15:26:20.782977 IP 10.196.108.178.ssh > 156.151.8.14.48339: Flags [.], ack 145, win 873, length 0
15:26:23.110360 IP 156.151.8.9.63013 > 10.196.108.178.ssh: Flags [P.], seq 368:416, ack 673, win 259, length 48
15:26:23.150219 IP 10.196.108.178.ssh > 156.151.8.9.63013: Flags [.], ack 416, win 363, length 0
15:26:24.009497 IP 10.196.108.178.ssh > 156.151.8.5.53089: Flags [P.], seq 160:240, ack 97, win 452, length 80
15:26:24.627150 IP 156.151.8.9.63013 > 10.196.108.178.ssh: Flags [P.], seq 416:496, ack 673, win 259, length 80
15:26:24.627174 IP 10.196.108.178.ssh > 156.151.8.9.63013: Flags [.], ack 496, win 363, length 0
15:26:24.627722 IP 10.196.108.178.ssh > 156.151.8.9.63013: Flags [P.], seq 673:753, ack 496, win 363, length 80
15:26:24.636848 IP 156.151.8.5.53089 > 10.196.108.178.ssh: Flags [.], ack 240, win 32762, length 0
15:26:24.970352 IP 156.151.8.5.53089 > 10.196.108.178.ssh: Flags [P.], seq 97:145, ack 240, win 32762, length 48
15:26:24.970377 IP 10.196.108.178.ssh > 156.151.8.5.53089: Flags [.], ack 145, win 452, length 0
15:26:25.084851 IP 156.151.8.9.63013 > 10.196.108.178.ssh: Flags [.], ack 753, win 259, length 0
15:26:25.525362 IP 156.151.8.9.63013 > 10.196.108.178.ssh: Flags [P.], seq 496:560, ack 753, win 259, length 64
15:26:25.525999 IP 10.196.108.178.ssh > 156.151.8.9.63013: Flags [P.], seq 753:817, ack 560, win 363, length 64
15:26:25.527886 IP 10.196.108.178.ssh > 156.151.8.9.63013: Flags [P.], seq 817:945, ack 560, win 363, length 128
15:26:25.935364 IP 156.151.8.9.63013 > 10.196.108.178.ssh: Flags [.], ack 945, win 260, length 0
15:26:31.485142 IP 10.196.108.178.ssh > 156.151.8.8.42430: Flags [P.], seq 160:240, ack 97, win 387, length 80
15:26:32.019035 IP 156.151.8.8.42430 > 10.196.108.178.ssh: Flags [.], ack 240, win 32761, length 0
15:26:32.470844 IP 156.151.8.8.42430 > 10.196.108.178.ssh: Flags [P.], seq 97:145, ack 240, win 32761, length 48
15:26:32.470864 IP 10.196.108.178.ssh > 156.151.8.8.42430: Flags [.], ack 145, win 387, length 0
15:26:34.383640 IP 156.151.8.9.63013 > 10.196.108.178.ssh: Flags [P.], seq 560:704, ack 945, win 260, length 144
15:26:34.386720 IP 10.196.108.178.ssh > 156.151.8.9.63013: Flags [P.], seq 945:1089, ack 704, win 375, length 144
15:26:35.068887 IP 156.151.8.9.63013 > 10.196.108.178.ssh: Flags [.], ack 1089, win 260, length 0
15:26:35.679924 IP 156.151.8.9.63013 > 10.196.108.178.ssh: Flags [P.], seq 704:768, ack 1089, win 260, length 64
15:26:35.680393 IP 10.196.108.178.ssh > 156.151.8.9.63013: Flags [P.], seq 1089:1153, ack 768, win 375, length 64
15:26:35.791971 IP 10.196.108.178.ssh > 156.151.8.9.63013: Flags [P.], seq 1153:1249, ack 768, win 375, length 96
15:26:35.792065 IP 10.196.108.178.ssh > 156.151.8.9.63013: Flags [P.], seq 1249:1313, ack 768, win 375, length 64
15:26:35.794286 IP 10.196.108.178.ssh > 156.151.8.14.48339: Flags [P.], seq 336:416, ack 145, win 873, length 80
15:26:36.247396 IP 156.151.8.9.63013 > 10.196.108.178.ssh: Flags [.], ack 1249, win 259, length 0
15:26:36.247415 IP 10.196.108.178.ssh > 156.151.8.9.63013: Flags [.], seq 1313:2573, ack 768, win 375, length 1260
15:26:36.247427 IP 10.196.108.178.ssh > 156.151.8.9.63013: Flags [.], seq 2573:3833, ack 768, win 375, length 1260
15:26:36.249024 IP 156.151.8.14.48339 > 10.196.108.178.ssh: Flags [P.], seq 145:193, ack 416, win 259, length 48
15:26:36.249040 IP 10.196.108.178.ssh > 156.151.8.14.48339: Flags [.], ack 193, win 873, length 0
15:26:36.297921 IP 156.151.8.9.63013 > 10.196.108.178.ssh: Flags [.], ack 1313, win 259, length 0
15:26:36.297936 IP 10.196.108.178.ssh > 156.151.8.9.63013: Flags [P.], seq 3833:4273, ack 768, win 375, length 440
15:26:36.861660 IP 156.151.8.9.63013 > 10.196.108.178.ssh: Flags [.], ack 3833, win 260, length 0
15:26:36.861693 IP 10.196.108.178.ssh > 156.151.8.9.63013: Flags [.], seq 4273:5533, ack 768, win 375, length 1260
15:26:36.861708 IP 10.196.108.178.ssh > 156.151.8.9.63013: Flags [.], seq 5533:6793, ack 768, win 375, length 1260
15:26:36.912411 IP 156.151.8.9.63013 > 10.196.108.178.ssh: Flags [.], ack 4273, win 259, length 0
15:26:36.912436 IP 10.196.108.178.ssh > 156.151.8.9.63013: Flags [P.], seq 6793:7457, ack 768, win 375, length 664
15:26:37.476169 IP 156.151.8.9.63013 > 10.196.108.178.ssh: Flags [.], ack 6793, win 260, length 0
15:26:37.527110 IP 156.151.8.9.63013 > 10.196.108.178.ssh: Flags [.], ack 7457, win 260, length 0
15:26:39.307181 IP 156.151.8.9.63013 > 10.196.108.178.ssh: Flags [P.], seq 768:832, ack 7457, win 260, length 64
15:26:39.307360 IP 10.196.108.178.ssh > 156.151.8.9.63013: Flags [P.], seq 7457:7521, ack 832, win 375, length 64
15:26:39.728933 IP 156.151.8.9.63013 > 10.196.108.178.ssh: Flags [P.], seq 832:896, ack 7521, win 260, length 64
15:26:39.729101 IP 10.196.108.178.ssh > 156.151.8.9.63013: Flags [P.], seq 7521:7585, ack 896, win 375, length 64
15:26:39.982825 IP 10.196.108.178.ssh > 156.151.8.5.53089: Flags [P.], seq 240:320, ack 145, win 452, length 80
15:26:40.342908 IP 156.151.8.9.63013 > 10.196.108.178.ssh: Flags [P.], seq 896:960, ack 7585, win 260, length 64
15:26:40.343278 IP 10.196.108.178.ssh > 156.151.8.9.63013: Flags [P.], seq 7585:7649, ack 960, win 375, length 64
15:26:40.451576 IP 156.151.8.5.53089 > 10.196.108.178.ssh: Flags [.], ack 320, win 32761, length 0
15:26:40.472836 IP 156.151.8.5.53089 > 10.196.108.178.ssh: Flags [P.], seq 145:193, ack 320, win 32761, length 48
15:26:40.472858 IP 10.196.108.178.ssh > 156.151.8.5.53089: Flags [.], ack 193, win 452, length 0
15:26:40.578345 IP 10.196.108.178.ssh > 156.151.8.9.63013: Flags [P.], seq 7649:7729, ack 960, win 375, length 80
15:26:40.905184 IP 156.151.8.9.63013 > 10.196.108.178.ssh: Flags [.], ack 7649, win 260, length 0
15:26:41.034882 IP 156.151.8.9.63013 > 10.196.108.178.ssh: Flags [.], ack 7729, win 259, length 0
15:26:47.482497 IP 10.196.108.178.ssh > 156.151.8.8.42430: Flags [P.], seq 240:320, ack 145, win 387, length 80
15:26:48.063403 IP 156.151.8.9.63013 > 10.196.108.178.ssh: Flags [P.], seq 960:1024, ack 7729, win 259, length 64
15:26:48.063599 IP 10.196.108.178.ssh > 156.151.8.9.63013: Flags [P.], seq 7729:7793, ack 1024, win 375, length 64
15:26:48.126968 IP 156.151.8.8.42430 > 10.196.108.178.ssh: Flags [.], ack 320, win 32761, length 0
15:26:48.470248 IP 156.151.8.8.42430 > 10.196.108.178.ssh: Flags [P.], seq 145:193, ack 320, win 32761, length 48
15:26:48.470278 IP 10.196.108.178.ssh > 156.151.8.8.42430: Flags [.], ack 193, win 387, length 0
15:26:48.471045 IP 156.151.8.9.63013 > 10.196.108.178.ssh: Flags [P.], seq 1024:1088, ack 7793, win 259, length 64
15:26:48.471190 IP 10.196.108.178.ssh > 156.151.8.9.63013: Flags [P.], seq 7793:7857, ack 1088, win 375, length 64
15:26:49.097723 IP 156.151.8.9.63013 > 10.196.108.178.ssh: Flags [.], ack 7857, win 259, length 0
15:26:49.352432 IP 156.151.8.9.63013 > 10.196.108.178.ssh: Flags [P.], seq 1088:1152, ack 7857, win 259, length 64
15:26:49.352582 IP 10.196.108.178.ssh > 156.151.8.9.63013: Flags [P.], seq 7857:7921, ack 1152, win 375, length 64
15:26:49.810682 IP 156.151.8.9.63013 > 10.196.108.178.ssh: Flags [.], ack 7921, win 259, length 0
15:26:50.497419 IP 156.151.8.9.63013 > 10.196.108.178.ssh: Flags [P.], seq 1152:1216, ack 7921, win 259, length 64
15:26:50.497575 IP 10.196.108.178.ssh > 156.151.8.9.63013: Flags [P.], seq 7921:7985, ack 1216, win 375, length 64
15:26:50.795996 IP 156.151.8.14.48339 > 10.196.108.178.ssh: Flags [P.], seq 193:241, ack 416, win 259, length 48
15:26:50.796016 IP 10.196.108.178.ssh > 156.151.8.14.48339: Flags [.], ack 241, win 873, length 0
15:26:51.095004 IP 156.151.8.9.63013 > 10.196.108.178.ssh: Flags [P.], seq 1216:1280, ack 7985, win 258, length 64
15:26:51.095152 IP 10.196.108.178.ssh > 156.151.8.9.63013: Flags [P.], seq 7985:8049, ack 1280, win 375, length 64
15:26:51.612189 IP 156.151.8.9.63013 > 10.196.108.178.ssh: Flags [P.], seq 1280:1344, ack 8049, win 260, length 64
15:26:51.612334 IP 10.196.108.178.ssh > 156.151.8.9.63013: Flags [P.], seq 8049:8113, ack 1344, win 375, length 64
15:26:52.272176 IP 156.151.8.9.63013 > 10.196.108.178.ssh: Flags [.], ack 8113, win 260, length 0
15:26:52.787033 IP 156.151.8.9.63013 > 10.196.108.178.ssh: Flags [P.], seq 1344:1408, ack 8113, win 260, length 64
15:26:52.787183 IP 10.196.108.178.ssh > 156.151.8.9.63013: Flags [P.], seq 8113:8177, ack 1408, win 375, length 64
15:26:53.454269 IP 156.151.8.9.63013 > 10.196.108.178.ssh: Flags [P.], seq 1408:1456, ack 8177, win 260, length 48
15:26:53.494196 IP 10.196.108.178.ssh > 156.151.8.9.63013: Flags [.], ack 1456, win 375, length 0
15:26:54.642203 IP 156.151.8.9.63013 > 10.196.108.178.ssh: Flags [P.], seq 1456:1520, ack 8177, win 260, length 64
15:26:54.642238 IP 10.196.108.178.ssh > 156.151.8.9.63013: Flags [.], ack 1520, win 375, length 0
15:26:54.642483 IP 10.196.108.178.ssh > 156.151.8.9.63013: Flags [P.], seq 8177:8241, ack 1520, win 375, length 64
15:26:54.675400 IP 10.196.108.178.ssh > 156.151.8.9.63013: Flags [P.], seq 8241:8305, ack 1520, win 375, length 64
15:26:55.293676 IP 156.151.8.9.63013 > 10.196.108.178.ssh: Flags [.], ack 8305, win 259, length 0
15:26:55.483561 IP 10.196.108.178.ssh > 156.151.8.5.53089: Flags [P.], seq 320:400, ack 193, win 452, length 80
15:26:55.970326 IP 156.151.8.5.53089 > 10.196.108.178.ssh: Flags [.], ack 400, win 32761, length 0
15:26:55.971549 IP 156.151.8.5.53089 > 10.196.108.178.ssh: Flags [P.], seq 193:241, ack 400, win 32761, length 48
15:26:55.971569 IP 10.196.108.178.ssh > 156.151.8.5.53089: Flags [.], ack 241, win 452, length 0
15:26:57.316957 IP 156.151.8.9.63013 > 10.196.108.178.ssh: Flags [P.], seq 1520:1584, ack 8305, win 259, length 64
15:26:57.317124 IP 10.196.108.178.ssh > 156.151.8.9.63013: Flags [P.], seq 8305:8369, ack 1584, win 375, length 64
15:26:57.786210 IP 156.151.8.9.63013 > 10.196.108.178.ssh: Flags [P.], seq 1584:1648, ack 8369, win 259, length 64
15:26:57.786386 IP 10.196.108.178.ssh > 156.151.8.9.63013: Flags [P.], seq 8369:8433, ack 1648, win 375, length 64
15:26:58.365463 IP 156.151.8.9.63013 > 10.196.108.178.ssh: Flags [P.], seq 1648:1712, ack 8433, win 259, length 64
15:26:58.365607 IP 10.196.108.178.ssh > 156.151.8.9.63013: Flags [P.], seq 8433:8497, ack 1712, win 375, length 64
15:26:58.979669 IP 156.151.8.9.63013 > 10.196.108.178.ssh: Flags [P.], seq 1712:1776, ack 8497, win 259, length 64
15:26:58.979852 IP 10.196.108.178.ssh > 156.151.8.9.63013: Flags [P.], seq 8497:8593, ack 1776, win 375, length 96
15:26:59.645650 IP 156.151.8.9.63013 > 10.196.108.178.ssh: Flags [.], ack 8593, win 260, length 0
15:27:00.967924 IP 156.151.8.9.63013 > 10.196.108.178.ssh: Flags [P.], seq 1776:1840, ack 8593, win 260, length 64
15:27:00.968086 IP 10.196.108.178.ssh > 156.151.8.9.63013: Flags [P.], seq 8593:8657, ack 1840, win 375, length 64
15:27:01.425686 IP 156.151.8.9.63013 > 10.196.108.178.ssh: Flags [.], ack 8657, win 260, length 0
15:27:01.769210 IP 156.151.8.9.63013 > 10.196.108.178.ssh: Flags [P.], seq 1840:1904, ack 8657, win 260, length 64
15:27:01.769410 IP 10.196.108.178.ssh > 156.151.8.9.63013: Flags [P.], seq 8657:8721, ack 1904, win 375, length 64
15:27:02.360064 IP 156.151.8.9.63013 > 10.196.108.178.ssh: Flags [P.], seq 1904:1968, ack 8721, win 260, length 64
15:27:02.360290 IP 10.196.108.178.ssh > 156.151.8.9.63013: Flags [P.], seq 8721:8785, ack 1968, win 375, length 64
15:27:03.075938 IP 156.151.8.9.63013 > 10.196.108.178.ssh: Flags [P.], seq 1968:2032, ack 8785, win 260, length 64
15:27:03.076074 IP 10.196.108.178.ssh > 156.151.8.9.63013: Flags [P.], seq 8785:8849, ack 2032, win 375, length 64
15:27:03.484319 IP 10.196.108.178.ssh > 156.151.8.8.42430: Flags [P.], seq 320:400, ack 193, win 387, length 80
15:27:03.740694 IP 156.151.8.9.63013 > 10.196.108.178.ssh: Flags [.], ack 8849, win 259, length 0
15:27:04.060501 IP 156.151.8.8.42430 > 10.196.108.178.ssh: Flags [.], ack 400, win 32760, length 0
15:27:04.423666 IP 156.151.8.9.63013 > 10.196.108.178.ssh: Flags [P.], seq 2032:2096, ack 8849, win 259, length 64
15:27:04.423941 IP 10.196.108.178.ssh > 156.151.8.9.63013: Flags [P.], seq 8849:8913, ack 2096, win 375, length 64
15:27:04.471455 IP 156.151.8.8.42430 > 10.196.108.178.ssh: Flags [P.], seq 193:241, ack 400, win 32760, length 48
15:27:04.471480 IP 10.196.108.178.ssh > 156.151.8.8.42430: Flags [.], ack 241, win 387, length 0
15:27:05.185867 IP 156.151.8.9.63013 > 10.196.108.178.ssh: Flags [.], ack 8913, win 259, length 0
15:27:05.811559 IP 10.196.108.178.ssh > 156.151.8.14.48339: Flags [P.], seq 416:496, ack 241, win 873, length 80
15:27:06.355302 IP 156.151.8.14.48339 > 10.196.108.178.ssh: Flags [P.], seq 241:289, ack 496, win 258, length 48
15:27:06.355335 IP 10.196.108.178.ssh > 156.151.8.14.48339: Flags [.], ack 289, win 873, length 0
15:27:10.983093 IP 10.196.108.178.ssh > 156.151.8.5.53089: Flags [P.], seq 400:480, ack 241, win 452, length 80
15:27:11.639615 IP 156.151.8.5.53089 > 10.196.108.178.ssh: Flags [.], ack 480, win 32760, length 0
15:27:11.973880 IP 156.151.8.5.53089 > 10.196.108.178.ssh: Flags [P.], seq 241:289, ack 480, win 32760, length 48
15:27:11.973916 IP 10.196.108.178.ssh > 156.151.8.5.53089: Flags [.], ack 289, win 452, length 0
15:27:19.437674 IP 10.196.108.178.ssh > 156.151.8.9.63013: Flags [P.], seq 8913:8993, ack 2096, win 375, length 80
15:27:19.486708 IP 10.196.108.178.ssh > 156.151.8.8.42430: Flags [P.], seq 400:480, ack 241, win 387, length 80
15:27:19.871951 IP 156.151.8.9.63013 > 10.196.108.178.ssh: Flags [P.], seq 2096:2144, ack 8993, win 259, length 48
15:27:19.911219 IP 10.196.108.178.ssh > 156.151.8.9.63013: Flags [.], ack 2144, win 375, length 0
15:27:19.955222 IP 156.151.8.8.42430 > 10.196.108.178.ssh: Flags [.], ack 480, win 32759, length 0
15:27:20.000252 IP 156.151.8.8.42430 > 10.196.108.178.ssh: Flags [P.], seq 241:289, ack 480, win 32759, length 48
15:27:20.000271 IP 10.196.108.178.ssh > 156.151.8.8.42430: Flags [.], ack 289, win 387, length 0
15:27:20.811781 IP 156.151.8.14.48339 > 10.196.108.178.ssh: Flags [P.], seq 289:337, ack 496, win 258, length 48
15:27:20.811808 IP 10.196.108.178.ssh > 156.151.8.14.48339: Flags [.], ack 337, win 873, length 0
15:27:23.145552 IP 156.151.8.9.63013 > 10.196.108.178.ssh: Flags [P.], seq 2144:2192, ack 8993, win 259, length 48
15:27:23.145581 IP 10.196.108.178.ssh > 156.151.8.9.63013: Flags [.], ack 2192, win 375, length 0
15:27:26.989148 IP 10.196.108.178.ssh > 156.151.8.5.53089: Flags [P.], seq 480:560, ack 289, win 452, length 80
15:27:27.471120 IP 156.151.8.5.53089 > 10.196.108.178.ssh: Flags [P.], seq 289:337, ack 560, win 32759, length 48
15:27:27.471149 IP 10.196.108.178.ssh > 156.151.8.5.53089: Flags [.], ack 337, win 452, length 0
15:27:35.003635 IP 10.196.108.178.ssh > 156.151.8.8.42430: Flags [P.], seq 480:560, ack 289, win 387, length 80
15:27:35.599679 IP 156.151.8.8.42430 > 10.196.108.178.ssh: Flags [.], ack 560, win 32759, length 0
15:27:35.823288 IP 10.196.108.178.ssh > 156.151.8.14.48339: Flags [P.], seq 496:576, ack 337, win 873, length 80
15:27:35.973725 IP 156.151.8.8.42430 > 10.196.108.178.ssh: Flags [P.], seq 289:337, ack 560, win 32759, length 48
15:27:35.973747 IP 10.196.108.178.ssh > 156.151.8.8.42430: Flags [.], ack 337, win 387, length 0
15:27:36.458489 IP 156.151.8.14.48339 > 10.196.108.178.ssh: Flags [P.], seq 337:385, ack 576, win 260, length 48
15:27:36.458516 IP 10.196.108.178.ssh > 156.151.8.14.48339: Flags [.], ack 385, win 873, length 0
15:27:38.154489 IP 10.196.108.178.ssh > 156.151.8.9.63013: Flags [P.], seq 8993:9073, ack 2192, win 375, length 80
15:27:38.608787 IP 156.151.8.9.63013 > 10.196.108.178.ssh: Flags [P.], seq 2192:2240, ack 9073, win 258, length 48
15:27:38.608824 IP 10.196.108.178.ssh > 156.151.8.9.63013: Flags [.], ack 2240, win 375, length 0
15:27:42.486369 IP 10.196.108.178.ssh > 156.151.8.5.53089: Flags [P.], seq 560:640, ack 337, win 452, length 80
15:27:43.175637 IP 156.151.8.5.53089 > 10.196.108.178.ssh: Flags [.], ack 640, win 32759, length 0
15:27:43.471872 IP 156.151.8.5.53089 > 10.196.108.178.ssh: Flags [P.], seq 337:385, ack 640, win 32759, length 48
15:27:43.471894 IP 10.196.108.178.ssh > 156.151.8.5.53089: Flags [.], ack 385, win 452, length 0
15:27:50.837016 IP 156.151.8.14.48339 > 10.196.108.178.ssh: Flags [P.], seq 385:433, ack 576, win 260, length 48
15:27:50.837061 IP 10.196.108.178.ssh > 156.151.8.14.48339: Flags [.], ack 433, win 873, length 0
15:27:50.984376 IP 10.196.108.178.ssh > 156.151.8.8.42430: Flags [P.], seq 560:640, ack 337, win 387, length 80
15:27:51.470987 IP 156.151.8.8.42430 > 10.196.108.178.ssh: Flags [P.], seq 337:385, ack 640, win 32758, length 48
15:27:51.471014 IP 10.196.108.178.ssh > 156.151.8.8.42430: Flags [.], ack 385, win 387, length 0
15:27:53.154995 IP 156.151.8.9.63013 > 10.196.108.178.ssh: Flags [P.], seq 2240:2288, ack 9073, win 258, length 48
15:27:53.155018 IP 10.196.108.178.ssh > 156.151.8.9.63013: Flags [.], ack 2288, win 375, length 0
15:27:58.486665 IP 10.196.108.178.ssh > 156.151.8.5.53089: Flags [P.], seq 640:720, ack 385, win 452, length 80
15:27:59.436224 IP 10.196.108.178.ssh > 156.151.8.5.53089: Flags [P.], seq 640:720, ack 385, win 452, length 80
15:27:59.457376 IP 156.151.8.5.53089 > 10.196.108.178.ssh: Flags [.], ack 720, win 32758, length 0
15:27:59.463895 IP 156.151.8.5.53089 > 10.196.108.178.ssh: Flags [P.], seq 385:433, ack 720, win 32758, length 48
15:27:59.463915 IP 10.196.108.178.ssh > 156.151.8.5.53089: Flags [.], ack 433, win 452, length 0
15:28:00.245347 IP 156.151.8.5.53089 > 10.196.108.178.ssh: Flags [P.], seq 385:433, ack 720, win 32758, length 48
15:28:00.245371 IP 10.196.108.178.ssh > 156.151.8.5.53089: Flags [.], ack 433, win 452, options [nop,nop,sack 1 {385:433}], length 0
15:28:00.249860 IP 156.151.8.5.53089 > 10.196.108.178.ssh: Flags [.], ack 720, win 32758, options [nop,nop,sack 1 {640:720}], length 0
15:28:05.840293 IP 10.196.108.178.ssh > 156.151.8.14.48339: Flags [P.], seq 576:656, ack 433, win 873, length 80
15:28:06.477449 IP 10.196.108.178.ssh > 156.151.8.8.42430: Flags [P.], seq 640:720, ack 385, win 387, length 80
15:28:06.564592 IP 156.151.8.14.48339 > 10.196.108.178.ssh: Flags [P.], seq 433:481, ack 656, win 260, length 48
15:28:06.564618 IP 10.196.108.178.ssh > 156.151.8.14.48339: Flags [.], ack 481, win 873, length 0
15:28:07.240597 IP 156.151.8.8.42430 > 10.196.108.178.ssh: Flags [.], ack 720, win 32768, length 0
15:28:07.480283 IP 156.151.8.8.42430 > 10.196.108.178.ssh: Flags [P.], seq 385:433, ack 720, win 32768, length 48
15:28:07.480315 IP 10.196.108.178.ssh > 156.151.8.8.42430: Flags [.], ack 433, win 387, length 0
15:28:08.163639 IP 10.196.108.178.ssh > 156.151.8.9.63013: Flags [P.], seq 9073:9153, ack 2288, win 375, length 80
15:28:08.714742 IP 156.151.8.9.63013 > 10.196.108.178.ssh: Flags [P.], seq 2288:2336, ack 9153, win 260, length 48
15:28:08.714769 IP 10.196.108.178.ssh > 156.151.8.9.63013: Flags [.], ack 2336, win 375, length 0
15:28:14.476923 IP 10.196.108.178.ssh > 156.151.8.5.53089: Flags [P.], seq 720:800, ack 433, win 452, length 80
15:28:15.227366 IP 156.151.8.5.53089 > 10.196.108.178.ssh: Flags [.], ack 800, win 32768, length 0
15:28:15.474216 IP 156.151.8.5.53089 > 10.196.108.178.ssh: Flags [P.], seq 433:481, ack 800, win 32768, length 48
15:28:15.474238 IP 10.196.108.178.ssh > 156.151.8.5.53089: Flags [.], ack 481, win 452, length 0
15:28:20.844053 IP 156.151.8.14.48339 > 10.196.108.178.ssh: Flags [P.], seq 481:529, ack 656, win 260, length 48
15:28:20.844085 IP 10.196.108.178.ssh > 156.151.8.14.48339: Flags [.], ack 529, win 873, length 0
15:28:22.487046 IP 10.196.108.178.ssh > 156.151.8.8.42430: Flags [P.], seq 720:800, ack 433, win 387, length 80
15:28:23.112536 IP 156.151.8.8.42430 > 10.196.108.178.ssh: Flags [.], ack 800, win 32767, length 0
15:28:23.174940 IP 156.151.8.9.63013 > 10.196.108.178.ssh: Flags [P.], seq 2336:2384, ack 9153, win 260, length 48
15:28:23.174960 IP 10.196.108.178.ssh > 156.151.8.9.63013: Flags [.], ack 2384, win 375, length 0
15:28:23.472790 IP 156.151.8.8.42430 > 10.196.108.178.ssh: Flags [P.], seq 433:481, ack 800, win 32767, length 48
15:28:23.472811 IP 10.196.108.178.ssh > 156.151.8.8.42430: Flags [.], ack 481, win 387, length 0
15:28:23.956527 IP 156.151.8.9.63013 > 10.196.108.178.ssh: Flags [P.], seq 2336:2384, ack 9153, win 260, length 48
15:28:23.956542 IP 10.196.108.178.ssh > 156.151.8.9.63013: Flags [.], ack 2384, win 375, options [nop,nop,sack 1 {2336:2384}], length 0
15:28:30.475963 IP 10.196.108.178.ssh > 156.151.8.5.53089: Flags [P.], seq 800:880, ack 481, win 452, length 80
15:28:30.945693 IP 156.151.8.5.53089 > 10.196.108.178.ssh: Flags [.], ack 880, win 32767, length 0
15:28:31.013904 IP 156.151.8.5.53089 > 10.196.108.178.ssh: Flags [P.], seq 481:529, ack 880, win 32767, length 48
15:28:31.013928 IP 10.196.108.178.ssh > 156.151.8.5.53089: Flags [.], ack 529, win 452, length 0
15:28:35.859336 IP 10.196.108.178.ssh > 156.151.8.14.48339: Flags [P.], seq 656:736, ack 529, win 873, length 80
15:28:36.362780 IP 156.151.8.14.48339 > 10.196.108.178.ssh: Flags [P.], seq 529:577, ack 736, win 260, length 48
15:28:36.362810 IP 10.196.108.178.ssh > 156.151.8.14.48339: Flags [.], ack 577, win 873, length 0
15:28:38.179503 IP 10.196.108.178.ssh > 156.151.8.9.63013: Flags [P.], seq 9153:9233, ack 2384, win 375, length 80
15:28:38.476276 IP 10.196.108.178.ssh > 156.151.8.8.42430: Flags [P.], seq 800:880, ack 481, win 387, length 80
15:28:38.585954 IP 156.151.8.9.63013 > 10.196.108.178.ssh: Flags [P.], seq 2384:2432, ack 9233, win 260, length 48
15:28:38.585981 IP 10.196.108.178.ssh > 156.151.8.9.63013: Flags [.], ack 2432, win 375, length 0
15:28:38.984289 IP 156.151.8.8.42430 > 10.196.108.178.ssh: Flags [.], ack 880, win 32766, length 0
15:28:39.009002 IP 156.151.8.8.42430 > 10.196.108.178.ssh: Flags [P.], seq 481:529, ack 880, win 32766, length 48
15:28:39.009020 IP 10.196.108.178.ssh > 156.151.8.8.42430: Flags [.], ack 529, win 387, length 0
15:28:46.019674 IP 10.196.108.178.ssh > 156.151.8.5.53089: Flags [P.], seq 880:960, ack 529, win 452, length 80
15:28:46.562161 IP 156.151.8.5.53089 > 10.196.108.178.ssh: Flags [.], ack 960, win 32766, length 0
15:28:46.971933 IP 156.151.8.5.53089 > 10.196.108.178.ssh: Flags [P.], seq 529:577, ack 960, win 32766, length 48
15:28:46.971954 IP 10.196.108.178.ssh > 156.151.8.5.53089: Flags [.], ack 577, win 452, length 0
15:28:50.861824 IP 156.151.8.14.48339 > 10.196.108.178.ssh: Flags [P.], seq 577:625, ack 736, win 260, length 48
15:28:50.861852 IP 10.196.108.178.ssh > 156.151.8.14.48339: Flags [.], ack 625, win 873, length 0
15:28:53.189013 IP 156.151.8.9.63013 > 10.196.108.178.ssh: Flags [P.], seq 2432:2480, ack 9233, win 260, length 48
15:28:53.189038 IP 10.196.108.178.ssh > 156.151.8.9.63013: Flags [.], ack 2480, win 375, length 0
15:28:54.020547 IP 10.196.108.178.ssh > 156.151.8.8.42430: Flags [P.], seq 880:960, ack 529, win 387, length 80
15:28:54.754822 IP 156.151.8.8.42430 > 10.196.108.178.ssh: Flags [.], ack 960, win 32766, length 0
15:28:54.971098 IP 156.151.8.8.42430 > 10.196.108.178.ssh: Flags [P.], seq 529:577, ack 960, win 32766, length 48
15:28:54.971123 IP 10.196.108.178.ssh > 156.151.8.8.42430: Flags [.], ack 577, win 387, length 0
15:29:01.984601 IP 10.196.108.178.ssh > 156.151.8.5.53089: Flags [P.], seq 960:1040, ack 577, win 452, length 80
15:29:02.454227 IP 156.151.8.5.53089 > 10.196.108.178.ssh: Flags [.], ack 1040, win 32766, length 0
15:29:02.464651 IP 156.151.8.5.53089 > 10.196.108.178.ssh: Flags [P.], seq 577:625, ack 1040, win 32766, length 48
15:29:02.464671 IP 10.196.108.178.ssh > 156.151.8.5.53089: Flags [.], ack 625, win 452, length 0
15:29:05.874628 IP 10.196.108.178.ssh > 156.151.8.14.48339: Flags [P.], seq 736:816, ack 625, win 873, length 80
15:29:06.365619 IP 156.151.8.14.48339 > 10.196.108.178.ssh: Flags [P.], seq 625:673, ack 816, win 259, length 48
15:29:06.365648 IP 10.196.108.178.ssh > 156.151.8.14.48339: Flags [.], ack 673, win 873, length 0
15:29:08.195294 IP 10.196.108.178.ssh > 156.151.8.9.63013: Flags [P.], seq 9233:9313, ack 2480, win 375, length 80
15:29:08.822739 IP 156.151.8.9.63013 > 10.196.108.178.ssh: Flags [P.], seq 2480:2528, ack 9313, win 260, length 48
15:29:08.822764 IP 10.196.108.178.ssh > 156.151.8.9.63013: Flags [.], ack 2528, win 375, length 0
15:29:09.986167 IP 10.196.108.178.ssh > 156.151.8.8.42430: Flags [P.], seq 960:1040, ack 577, win 387, length 80
15:29:10.728068 IP 156.151.8.8.42430 > 10.196.108.178.ssh: Flags [.], ack 1040, win 32765, length 0
15:29:10.971060 IP 156.151.8.8.42430 > 10.196.108.178.ssh: Flags [P.], seq 577:625, ack 1040, win 32765, length 48
15:29:10.971089 IP 10.196.108.178.ssh > 156.151.8.8.42430: Flags [.], ack 625, win 387, length 0
15:29:17.479903 IP 10.196.108.178.ssh > 156.151.8.5.53089: Flags [P.], seq 1040:1120, ack 625, win 452, length 80
15:29:18.203661 IP 156.151.8.5.53089 > 10.196.108.178.ssh: Flags [.], ack 1120, win 32765, length 0
15:29:18.473433 IP 156.151.8.5.53089 > 10.196.108.178.ssh: Flags [P.], seq 625:673, ack 1120, win 32765, length 48
15:29:18.473457 IP 10.196.108.178.ssh > 156.151.8.5.53089: Flags [.], ack 673, win 452, length 0
15:29:20.874846 IP 156.151.8.14.48339 > 10.196.108.178.ssh: Flags [P.], seq 673:721, ack 816, win 259, length 48
15:29:20.874878 IP 10.196.108.178.ssh > 156.151.8.14.48339: Flags [.], ack 721, win 873, length 0
15:29:21.585480 IP 156.151.8.14.48339 > 10.196.108.178.ssh: Flags [.], seq 721:1257, ack 816, win 259, length 536
15:29:21.585501 IP 10.196.108.178.ssh > 156.151.8.14.48339: Flags [.], ack 1257, win 884, length 0
15:29:21.585611 IP 156.151.8.14.48339 > 10.196.108.178.ssh: Flags [P.], seq 1257:1457, ack 816, win 259, length 200
15:29:21.585622 IP 10.196.108.178.ssh > 156.151.8.14.48339: Flags [.], ack 1457, win 896, length 0
15:29:21.585963 IP 10.196.108.178.ssh > 156.151.8.14.48339: Flags [P.], seq 816:1696, ack 1457, win 896, length 880
15:29:22.033586 IP 156.151.8.14.48339 > 10.196.108.178.ssh: Flags [P.], seq 1457:1521, ack 1696, win 260, length 64
15:29:22.035822 IP 10.196.108.178.ssh > 156.151.8.14.48339: Flags [P.], seq 1696:2272, ack 1521, win 896, length 576
15:29:22.715086 IP 156.151.8.14.48339 > 10.196.108.178.ssh: Flags [.], ack 2272, win 260, length 0
15:29:22.788727 IP 156.151.8.14.48339 > 10.196.108.178.ssh: Flags [.], seq 1521:2057, ack 2272, win 260, length 536
15:29:22.788775 IP 156.151.8.14.48339 > 10.196.108.178.ssh: Flags [P.], seq 2057:2081, ack 2272, win 260, length 24
15:29:22.788824 IP 10.196.108.178.ssh > 156.151.8.14.48339: Flags [.], ack 2081, win 907, length 0
15:29:22.803630 IP 10.196.108.178.ssh > 156.151.8.14.48339: Flags [P.], seq 2272:3440, ack 2081, win 907, length 1168
15:29:23.208273 IP 156.151.8.9.63013 > 10.196.108.178.ssh: Flags [P.], seq 2528:2576, ack 9313, win 260, length 48
15:29:23.208298 IP 10.196.108.178.ssh > 156.151.8.9.63013: Flags [.], ack 2576, win 375, length 0
15:29:23.260087 IP 156.151.8.14.48339 > 10.196.108.178.ssh: Flags [.], ack 3440, win 260, length 0
15:29:23.367299 IP 156.151.8.14.48339 > 10.196.108.178.ssh: Flags [P.], seq 2081:2129, ack 3440, win 260, length 48
15:29:23.407219 IP 10.196.108.178.ssh > 156.151.8.14.48339: Flags [.], ack 2129, win 907, length 0
15:29:25.980225 IP 10.196.108.178.ssh > 156.151.8.8.42430: Flags [P.], seq 1040:1120, ack 625, win 387, length 80
15:29:26.702055 IP 156.151.8.8.42430 > 10.196.108.178.ssh: Flags [.], ack 1120, win 32764, length 0
15:29:26.968817 IP 156.151.8.8.42430 > 10.196.108.178.ssh: Flags [P.], seq 625:673, ack 1120, win 32764, length 48
15:29:26.968846 IP 10.196.108.178.ssh > 156.151.8.8.42430: Flags [.], ack 673, win 387, length 0
15:29:33.485327 IP 10.196.108.178.ssh > 156.151.8.5.53089: Flags [P.], seq 1120:1200, ack 673, win 452, length 80
15:29:34.181151 IP 156.151.8.5.53089 > 10.196.108.178.ssh: Flags [.], ack 1200, win 32764, length 0
15:29:34.472053 IP 156.151.8.5.53089 > 10.196.108.178.ssh: Flags [P.], seq 673:721, ack 1200, win 32764, length 48
15:29:34.472075 IP 10.196.108.178.ssh > 156.151.8.5.53089: Flags [.], ack 721, win 452, length 0
15:29:38.214122 IP 10.196.108.178.ssh > 156.151.8.9.63013: Flags [P.], seq 9313:9393, ack 2576, win 375, length 80
15:29:38.368131 IP 10.196.108.178.ssh > 156.151.8.14.48339: Flags [P.], seq 3440:3520, ack 2129, win 907, length 80
15:29:38.723797 IP 156.151.8.9.63013 > 10.196.108.178.ssh: Flags [P.], seq 2576:2624, ack 9393, win 259, length 48
15:29:38.723830 IP 10.196.108.178.ssh > 156.151.8.9.63013: Flags [.], ack 2624, win 375, length 0
15:29:38.775850 IP 156.151.8.14.48339 > 10.196.108.178.ssh: Flags [P.], seq 2129:2177, ack 3520, win 260, length 48
15:29:38.775877 IP 10.196.108.178.ssh > 156.151.8.14.48339: Flags [.], ack 2177, win 907, length 0
15:29:41.974499 IP 10.196.108.178.ssh > 156.151.8.8.42430: Flags [P.], seq 1120:1200, ack 673, win 387, length 80
15:29:42.575096 IP 156.151.8.8.42430 > 10.196.108.178.ssh: Flags [.], ack 1200, win 32764, length 0
15:29:42.973586 IP 156.151.8.8.42430 > 10.196.108.178.ssh: Flags [P.], seq 673:721, ack 1200, win 32764, length 48
15:29:42.973612 IP 10.196.108.178.ssh > 156.151.8.8.42430: Flags [.], ack 721, win 387, length 0
15:29:49.480557 IP 10.196.108.178.ssh > 156.151.8.5.53089: Flags [P.], seq 1200:1280, ack 721, win 452, length 80
15:29:50.254413 IP 156.151.8.5.53089 > 10.196.108.178.ssh: Flags [.], ack 1280, win 32764, length 0
15:29:50.473946 IP 156.151.8.5.53089 > 10.196.108.178.ssh: Flags [P.], seq 721:769, ack 1280, win 32764, length 48
15:29:50.473978 IP 10.196.108.178.ssh > 156.151.8.5.53089: Flags [.], ack 769, win 452, length 0
15:29:50.914918 IP 156.151.8.14.48339 > 10.196.108.178.ssh: Flags [P.], seq 2177:2225, ack 3520, win 260, length 48
15:29:50.914947 IP 10.196.108.178.ssh > 156.151.8.14.48339: Flags [.], ack 2225, win 907, length 0
15:29:53.217284 IP 156.151.8.9.63013 > 10.196.108.178.ssh: Flags [P.], seq 2624:2672, ack 9393, win 259, length 48
15:29:53.217309 IP 10.196.108.178.ssh > 156.151.8.9.63013: Flags [.], ack 2672, win 375, length 0
15:29:57.988856 IP 10.196.108.178.ssh > 156.151.8.8.42430: Flags [P.], seq 1200:1280, ack 721, win 387, length 80
15:29:58.754567 IP 156.151.8.8.42430 > 10.196.108.178.ssh: Flags [.], ack 1280, win 32763, length 0
15:29:58.970088 IP 156.151.8.8.42430 > 10.196.108.178.ssh: Flags [P.], seq 721:769, ack 1280, win 32763, length 48
15:29:58.970134 IP 10.196.108.178.ssh > 156.151.8.8.42430: Flags [.], ack 769, win 387, length 0
15:30:05.476092 IP 10.196.108.178.ssh > 156.151.8.5.53089: Flags [P.], seq 1280:1360, ack 769, win 452, length 80
15:30:05.927507 IP 10.196.108.178.ssh > 156.151.8.14.48339: Flags [P.], seq 3520:3600, ack 2225, win 907, length 80
15:30:05.959057 IP 156.151.8.5.53089 > 10.196.108.178.ssh: Flags [.], ack 1360, win 32763, length 0
15:30:05.972457 IP 156.151.8.5.53089 > 10.196.108.178.ssh: Flags [P.], seq 769:817, ack 1360, win 32763, length 48
15:30:05.972475 IP 10.196.108.178.ssh > 156.151.8.5.53089: Flags [.], ack 817, win 452, length 0
15:30:06.576925 IP 156.151.8.14.48339 > 10.196.108.178.ssh: Flags [P.], seq 2225:2273, ack 3600, win 260, length 48
15:30:06.576952 IP 10.196.108.178.ssh > 156.151.8.14.48339: Flags [.], ack 2273, win 907, length 0
15:30:08.232532 IP 10.196.108.178.ssh > 156.151.8.9.63013: Flags [P.], seq 9393:9473, ack 2672, win 375, length 80
15:30:08.726816 IP 156.151.8.9.63013 > 10.196.108.178.ssh: Flags [P.], seq 2672:2720, ack 9473, win 259, length 48
15:30:08.726844 IP 10.196.108.178.ssh > 156.151.8.9.63013: Flags [.], ack 2720, win 375, length 0
15:30:13.973283 IP 10.196.108.178.ssh > 156.151.8.8.42430: Flags [P.], seq 1280:1360, ack 769, win 387, length 80
15:30:14.523571 IP 156.151.8.8.42430 > 10.196.108.178.ssh: Flags [.], ack 1360, win 32763, length 0
15:30:14.975568 IP 156.151.8.8.42430 > 10.196.108.178.ssh: Flags [P.], seq 769:817, ack 1360, win 32763, length 48
15:30:14.975589 IP 10.196.108.178.ssh > 156.151.8.8.42430: Flags [.], ack 817, win 387, length 0
15:30:20.910883 IP 156.151.8.14.48339 > 10.196.108.178.ssh: Flags [P.], seq 2273:2321, ack 3600, win 260, length 48
15:30:20.910920 IP 10.196.108.178.ssh > 156.151.8.14.48339: Flags [.], ack 2321, win 907, length 0
15:30:20.985922 IP 10.196.108.178.ssh > 156.151.8.5.53089: Flags [P.], seq 1360:1440, ack 817, win 452, length 80
15:30:21.454686 IP 156.151.8.5.53089 > 10.196.108.178.ssh: Flags [.], ack 1440, win 32763, length 0
15:30:21.464921 IP 156.151.8.5.53089 > 10.196.108.178.ssh: Flags [P.], seq 817:865, ack 1440, win 32763, length 48
15:30:21.464936 IP 10.196.108.178.ssh > 156.151.8.5.53089: Flags [.], ack 865, win 452, length 0
15:30:23.235799 IP 156.151.8.9.63013 > 10.196.108.178.ssh: Flags [P.], seq 2720:2768, ack 9473, win 259, length 48
15:30:23.235824 IP 10.196.108.178.ssh > 156.151.8.9.63013: Flags [.], ack 2768, win 375, length 0
15:30:29.986569 IP 10.196.108.178.ssh > 156.151.8.8.42430: Flags [P.], seq 1360:1440, ack 817, win 387, length 80
15:30:30.455825 IP 156.151.8.8.42430 > 10.196.108.178.ssh: Flags [.], ack 1440, win 32762, length 0
15:30:30.465817 IP 156.151.8.8.42430 > 10.196.108.178.ssh: Flags [P.], seq 817:865, ack 1440, win 32762, length 48
15:30:30.465839 IP 10.196.108.178.ssh > 156.151.8.8.42430: Flags [.], ack 865, win 387, length 0
15:30:35.913710 IP 10.196.108.178.ssh > 156.151.8.14.48339: Flags [P.], seq 3600:3680, ack 2321, win 907, length 80
15:30:36.367860 IP 156.151.8.14.48339 > 10.196.108.178.ssh: Flags [P.], seq 2321:2369, ack 3680, win 259, length 48
15:30:36.367898 IP 10.196.108.178.ssh > 156.151.8.14.48339: Flags [.], ack 2369, win 907, length 0
15:30:36.479054 IP 10.196.108.178.ssh > 156.151.8.5.53089: Flags [P.], seq 1440:1520, ack 865, win 452, length 80
15:30:37.051954 IP 156.151.8.5.53089 > 10.196.108.178.ssh: Flags [.], ack 1520, win 32762, length 0
15:30:37.469188 IP 156.151.8.5.53089 > 10.196.108.178.ssh: Flags [P.], seq 865:913, ack 1520, win 32762, length 48
15:30:37.469218 IP 10.196.108.178.ssh > 156.151.8.5.53089: Flags [.], ack 913, win 452, length 0
15:30:38.251034 IP 10.196.108.178.ssh > 156.151.8.9.63013: Flags [P.], seq 9473:9553, ack 2768, win 375, length 80
15:30:38.938783 IP 156.151.8.9.63013 > 10.196.108.178.ssh: Flags [P.], seq 2768:2816, ack 9553, win 259, length 48
15:30:38.938806 IP 10.196.108.178.ssh > 156.151.8.9.63013: Flags [.], ack 2816, win 375, length 0
15:30:45.481057 IP 10.196.108.178.ssh > 156.151.8.8.42430: Flags [P.], seq 1440:1520, ack 865, win 387, length 80
15:30:45.953121 IP 156.151.8.8.42430 > 10.196.108.178.ssh: Flags [.], ack 1520, win 32761, length 0
15:30:45.965134 IP 156.151.8.8.42430 > 10.196.108.178.ssh: Flags [P.], seq 865:913, ack 1520, win 32761, length 48
15:30:45.965154 IP 10.196.108.178.ssh > 156.151.8.8.42430: Flags [.], ack 913, win 387, length 0
15:30:50.929916 IP 156.151.8.14.48339 > 10.196.108.178.ssh: Flags [P.], seq 2369:2417, ack 3680, win 259, length 48
15:30:50.929959 IP 10.196.108.178.ssh > 156.151.8.14.48339: Flags [.], ack 2417, win 907, length 0
15:30:52.474103 IP 10.196.108.178.ssh > 156.151.8.5.53089: Flags [P.], seq 1520:1600, ack 913, win 452, length 80
15:30:52.943014 IP 156.151.8.5.53089 > 10.196.108.178.ssh: Flags [.], ack 1600, win 32761, length 0
15:30:52.966264 IP 156.151.8.5.53089 > 10.196.108.178.ssh: Flags [P.], seq 913:961, ack 1600, win 32761, length 48
15:30:52.966289 IP 10.196.108.178.ssh > 156.151.8.5.53089: Flags [.], ack 961, win 452, length 0
15:30:53.249546 IP 156.151.8.9.63013 > 10.196.108.178.ssh: Flags [P.], seq 2816:2864, ack 9553, win 259, length 48
15:30:53.249567 IP 10.196.108.178.ssh > 156.151.8.9.63013: Flags [.], ack 2864, win 375, length 0
15:31:00.980379 IP 10.196.108.178.ssh > 156.151.8.8.42430: Flags [P.], seq 1520:1600, ack 913, win 387, length 80
15:31:01.451656 IP 156.151.8.8.42430 > 10.196.108.178.ssh: Flags [.], ack 1600, win 32761, length 0
15:31:01.509367 IP 156.151.8.8.42430 > 10.196.108.178.ssh: Flags [P.], seq 913:961, ack 1600, win 32761, length 48
15:31:01.509389 IP 10.196.108.178.ssh > 156.151.8.8.42430: Flags [.], ack 961, win 387, length 0
15:31:05.945252 IP 10.196.108.178.ssh > 156.151.8.14.48339: Flags [P.], seq 3680:3760, ack 2417, win 907, length 80
15:31:06.583644 IP 156.151.8.14.48339 > 10.196.108.178.ssh: Flags [P.], seq 2417:2465, ack 3760, win 259, length 48
15:31:06.583670 IP 10.196.108.178.ssh > 156.151.8.14.48339: Flags [.], ack 2465, win 907, length 0
15:31:07.978291 IP 10.196.108.178.ssh > 156.151.8.5.53089: Flags [P.], seq 1600:1680, ack 961, win 452, length 80
15:31:08.255393 IP 10.196.108.178.ssh > 156.151.8.9.63013: Flags [P.], seq 9553:9633, ack 2864, win 375, length 80
15:31:08.661283 IP 156.151.8.9.63013 > 10.196.108.178.ssh: Flags [P.], seq 2864:2912, ack 9633, win 258, length 48
15:31:08.661306 IP 10.196.108.178.ssh > 156.151.8.9.63013: Flags [.], ack 2912, win 375, length 0
15:31:08.692336 IP 156.151.8.5.53089 > 10.196.108.178.ssh: Flags [.], ack 1680, win 32761, length 0
15:31:08.968999 IP 156.151.8.5.53089 > 10.196.108.178.ssh: Flags [P.], seq 961:1009, ack 1680, win 32761, length 48
15:31:08.969025 IP 10.196.108.178.ssh > 156.151.8.5.53089: Flags [.], ack 1009, win 452, length 0
15:31:16.524608 IP 10.196.108.178.ssh > 156.151.8.8.42430: Flags [P.], seq 1600:1680, ack 961, win 387, length 80
15:31:16.967209 IP 156.151.8.8.42430 > 10.196.108.178.ssh: Flags [P.], seq 961:1009, ack 1680, win 32760, length 48
15:31:16.967239 IP 10.196.108.178.ssh > 156.151.8.8.42430: Flags [.], ack 1009, win 387, length 0
15:31:19.505787 IP 10.196.108.178.ssh > 156.151.8.9.63013: Flags [P.], seq 9633:9713, ack 2912, win 375, length 80
15:31:19.506671 IP 10.196.108.178.ssh > 156.151.8.9.63013: Flags [P.], seq 9713:9857, ack 2912, win 375, length 144
15:31:20.100097 IP 156.151.8.9.63013 > 10.196.108.178.ssh: Flags [.], ack 9857, win 260, length 0
15:31:20.944933 IP 156.151.8.14.48339 > 10.196.108.178.ssh: Flags [P.], seq 2465:2513, ack 3760, win 259, length 48
15:31:20.944966 IP 10.196.108.178.ssh > 156.151.8.14.48339: Flags [.], ack 2513, win 907, length 0
15:31:23.266589 IP 156.151.8.9.63013 > 10.196.108.178.ssh: Flags [P.], seq 2912:2960, ack 9857, win 260, length 48
15:31:23.266610 IP 10.196.108.178.ssh > 156.151.8.9.63013: Flags [.], ack 2960, win 375, length 0
15:31:23.970284 IP 10.196.108.178.ssh > 156.151.8.5.53089: Flags [P.], seq 1680:1760, ack 1009, win 452, length 80
15:31:24.565718 IP 156.151.8.5.53089 > 10.196.108.178.ssh: Flags [.], ack 1760, win 32760, length 0
15:31:24.967476 IP 156.151.8.5.53089 > 10.196.108.178.ssh: Flags [P.], seq 1009:1057, ack 1760, win 32760, length 48
15:31:24.967502 IP 10.196.108.178.ssh > 156.151.8.5.53089: Flags [.], ack 1057, win 452, length 0
15:31:26.493381 IP 221.194.47.224.34739 > 10.196.108.178.ssh: Flags [S], seq 315453352, win 29200, options [mss 1460,sackOK,TS val 6669937 ecr 0,nop,wscale 7], length 0
15:31:26.493424 IP 10.196.108.178.ssh > 221.194.47.224.34739: Flags [S.], seq 2144040193, ack 315453353, win 26844, options [mss 8960,sackOK,TS val 3448731089 ecr 6669937,nop,wscale 7], length 0
15:31:26.776685 IP 221.194.47.224.34739 > 10.196.108.178.ssh: Flags [.], ack 1, win 229, options [nop,nop,TS val 6670008 ecr 3448731089], length 0
15:31:26.776738 IP 221.194.47.224.34739 > 10.196.108.178.ssh: Flags [P.], seq 1:16, ack 1, win 229, options [nop,nop,TS val 6670008 ecr 3448731089], length 15
15:31:26.776750 IP 10.196.108.178.ssh > 221.194.47.224.34739: Flags [.], ack 16, win 210, options [nop,nop,TS val 3448731372 ecr 6670008], length 0
15:31:26.784490 IP 10.196.108.178.ssh > 221.194.47.224.34739: Flags [P.], seq 1:22, ack 16, win 210, options [nop,nop,TS val 3448731380 ecr 6670008], length 21
15:31:27.068165 IP 221.194.47.224.34739 > 10.196.108.178.ssh: Flags [.], ack 22, win 229, options [nop,nop,TS val 6670080 ecr 3448731380], length 0
15:31:27.068212 IP 10.196.108.178.ssh > 221.194.47.224.34739: Flags [P.], seq 22:862, ack 16, win 210, options [nop,nop,TS val 3448731664 ecr 6670080], length 840
15:31:27.068227 IP 221.194.47.224.34739 > 10.196.108.178.ssh: Flags [P.], seq 16:664, ack 22, win 229, options [nop,nop,TS val 6670080 ecr 3448731380], length 648
15:31:27.108217 IP 10.196.108.178.ssh > 221.194.47.224.34739: Flags [.], ack 664, win 220, options [nop,nop,TS val 3448731704 ecr 6670080], length 0
15:31:27.390634 IP 221.194.47.224.34739 > 10.196.108.178.ssh: Flags [.], ack 862, win 242, options [nop,nop,TS val 6670161 ecr 3448731664], length 0
15:31:27.392694 IP 221.194.47.224.34739 > 10.196.108.178.ssh: Flags [P.], seq 664:936, ack 862, win 242, options [nop,nop,TS val 6670161 ecr 3448731704], length 272
15:31:27.392712 IP 10.196.108.178.ssh > 221.194.47.224.34739: Flags [.], ack 936, win 230, options [nop,nop,TS val 3448731988 ecr 6670161], length 0
15:31:27.398127 IP 10.196.108.178.ssh > 221.194.47.224.34739: Flags [P.], seq 862:1710, ack 936, win 230, options [nop,nop,TS val 3448731993 ecr 6670161], length 848
15:31:27.681337 IP 221.194.47.224.34739 > 10.196.108.178.ssh: Flags [.], ack 1710, win 255, options [nop,nop,TS val 6670234 ecr 3448731993], length 0
15:31:27.682786 IP 221.194.47.224.34739 > 10.196.108.178.ssh: Flags [P.], seq 936:952, ack 1710, win 255, options [nop,nop,TS val 6670234 ecr 3448731993], length 16
15:31:27.722230 IP 10.196.108.178.ssh > 221.194.47.224.34739: Flags [.], ack 952, win 230, options [nop,nop,TS val 3448732318 ecr 6670234], length 0
15:31:28.006168 IP 221.194.47.224.34739 > 10.196.108.178.ssh: Flags [P.], seq 952:1004, ack 1710, win 255, options [nop,nop,TS val 6670315 ecr 3448732318], length 52
15:31:28.006215 IP 10.196.108.178.ssh > 221.194.47.224.34739: Flags [.], ack 1004, win 230, options [nop,nop,TS val 3448732602 ecr 6670315], length 0
15:31:28.006356 IP 10.196.108.178.ssh > 221.194.47.224.34739: Flags [P.], seq 1710:1762, ack 1004, win 230, options [nop,nop,TS val 3448732602 ecr 6670315], length 52
15:31:28.289656 IP 221.194.47.224.34739 > 10.196.108.178.ssh: Flags [P.], seq 1004:1072, ack 1762, win 255, options [nop,nop,TS val 6670386 ecr 3448732602], length 68
15:31:28.329225 IP 10.196.108.178.ssh > 221.194.47.224.34739: Flags [.], ack 1072, win 230, options [nop,nop,TS val 3448732925 ecr 6670386], length 0
15:31:31.973093 IP 10.196.108.178.ssh > 156.151.8.8.42430: Flags [P.], seq 1680:1760, ack 1009, win 387, length 80
15:31:32.552132 IP 156.151.8.8.42430 > 10.196.108.178.ssh: Flags [.], ack 1760, win 32759, length 0
15:31:32.967892 IP 156.151.8.8.42430 > 10.196.108.178.ssh: Flags [P.], seq 1009:1057, ack 1760, win 32759, length 48
15:31:32.967920 IP 10.196.108.178.ssh > 156.151.8.8.42430: Flags [.], ack 1057, win 387, length 0
15:31:35.946810 IP 10.196.108.178.ssh > 156.151.8.14.48339: Flags [P.], seq 3760:3840, ack 2513, win 907, length 80
15:31:36.353160 IP 156.151.8.14.48339 > 10.196.108.178.ssh: Flags [P.], seq 2513:2561, ack 3840, win 259, length 48
15:31:36.353181 IP 10.196.108.178.ssh > 156.151.8.14.48339: Flags [.], ack 2561, win 907, length 0
15:31:38.281824 IP 10.196.108.178.ssh > 156.151.8.9.63013: Flags [P.], seq 9857:9937, ack 2960, win 375, length 80
15:31:38.300111 IP 221.194.47.224.34739 > 10.196.108.178.ssh: Flags [P.], seq 1072:1124, ack 1762, win 255, options [nop,nop,TS val 6672888 ecr 3448732925], length 52
15:31:38.300130 IP 10.196.108.178.ssh > 221.194.47.224.34739: Flags [.], ack 1124, win 230, options [nop,nop,TS val 3448742895 ecr 6672888], length 0
15:31:38.300140 IP 221.194.47.224.34739 > 10.196.108.178.ssh: Flags [F.], seq 1124, ack 1762, win 255, options [nop,nop,TS val 6672888 ecr 3448732925], length 0
15:31:38.301109 IP 10.196.108.178.ssh > 221.194.47.224.34739: Flags [P.], seq 1762:1846, ack 1125, win 230, options [nop,nop,TS val 3448742896 ecr 6672888], length 84
15:31:38.305007 IP 10.196.108.178.ssh > 221.194.47.224.34739: Flags [F.], seq 1846, ack 1125, win 230, options [nop,nop,TS val 3448742900 ecr 6672888], length 0
15:31:38.584345 IP 221.194.47.224.34739 > 10.196.108.178.ssh: Flags [R], seq 315454477, win 0, length 0
15:31:38.588139 IP 221.194.47.224.34739 > 10.196.108.178.ssh: Flags [R], seq 315454477, win 0, length 0
15:31:38.736867 IP 156.151.8.9.63013 > 10.196.108.178.ssh: Flags [P.], seq 2960:3008, ack 9937, win 260, length 48
15:31:38.736892 IP 10.196.108.178.ssh > 156.151.8.9.63013: Flags [.], ack 3008, win 375, length 0
15:31:39.972422 IP 10.196.108.178.ssh > 156.151.8.5.53089: Flags [P.], seq 1760:1840, ack 1057, win 452, length 80
15:31:40.539645 IP 156.151.8.5.53089 > 10.196.108.178.ssh: Flags [.], ack 1840, win 32759, length 0
15:31:40.968240 IP 156.151.8.5.53089 > 10.196.108.178.ssh: Flags [P.], seq 1057:1105, ack 1840, win 32759, length 48
15:31:40.968265 IP 10.196.108.178.ssh > 156.151.8.5.53089: Flags [.], ack 1105, win 452, length 0
15:31:47.980625 IP 10.196.108.178.ssh > 156.151.8.8.42430: Flags [P.], seq 1760:1840, ack 1057, win 387, length 80
15:31:48.630370 IP 156.151.8.8.42430 > 10.196.108.178.ssh: Flags [.], ack 1840, win 32759, length 0
15:31:48.726571 IP 156.151.8.9.63013 > 10.196.108.178.ssh: Flags [P.], seq 3008:3072, ack 9937, win 260, length 64
15:31:48.726595 IP 10.196.108.178.ssh > 156.151.8.9.63013: Flags [.], ack 3072, win 375, length 0
15:31:48.726810 IP 10.196.108.178.ssh > 156.151.8.9.63013: Flags [P.], seq 9937:10001, ack 3072, win 375, length 64
15:31:48.965932 IP 156.151.8.8.42430 > 10.196.108.178.ssh: Flags [P.], seq 1057:1105, ack 1840, win 32759, length 48
15:31:48.965960 IP 10.196.108.178.ssh > 156.151.8.8.42430: Flags [.], ack 1105, win 387, length 0
15:31:49.386829 IP 156.151.8.9.63013 > 10.196.108.178.ssh: Flags [P.], seq 3072:3264, ack 9937, win 260, length 192
15:31:49.387064 IP 10.196.108.178.ssh > 156.151.8.9.63013: Flags [P.], seq 10001:10065, ack 3264, win 386, length 64
15:31:49.439301 IP 156.151.8.9.63013 > 10.196.108.178.ssh: Flags [.], ack 10001, win 260, length 0
15:31:50.051564 IP 156.151.8.9.63013 > 10.196.108.178.ssh: Flags [.], ack 10065, win 260, length 0
15:31:50.953396 IP 156.151.8.14.48339 > 10.196.108.178.ssh: Flags [P.], seq 2561:2609, ack 3840, win 259, length 48
15:31:50.953424 IP 10.196.108.178.ssh > 156.151.8.14.48339: Flags [.], ack 2609, win 907, length 0
15:31:51.339881 IP 156.151.8.9.63013 > 10.196.108.178.ssh: Flags [P.], seq 3264:3328, ack 10065, win 260, length 64
15:31:51.340438 IP 10.196.108.178.ssh > 156.151.8.9.63013: Flags [P.], seq 10065:10129, ack 3328, win 386, length 64
15:31:51.341623 IP 10.196.108.178.ssh > 156.151.8.9.63013: Flags [P.], seq 10129:10209, ack 3328, win 386, length 80
15:31:51.342164 IP 10.196.108.178.ssh > 156.151.8.9.63013: Flags [P.], seq 10209:10337, ack 3328, win 386, length 128
15:31:52.049328 IP 156.151.8.9.63013 > 10.196.108.178.ssh: Flags [.], ack 10209, win 259, length 0
15:31:52.100056 IP 156.151.8.9.63013 > 10.196.108.178.ssh: Flags [.], ack 10337, win 258, length 0
15:31:53.283140 IP 156.151.8.9.63013 > 10.196.108.178.ssh: Flags [P.], seq 3328:3376, ack 10337, win 258, length 48
15:31:53.322219 IP 10.196.108.178.ssh > 156.151.8.9.63013: Flags [.], ack 3376, win 386, length 0
15:31:54.984980 IP 156.151.8.9.63013 > 10.196.108.178.ssh: Flags [.], seq 3376:3912, ack 10337, win 258, length 536
15:31:54.985008 IP 10.196.108.178.ssh > 156.151.8.9.63013: Flags [.], ack 3912, win 398, length 0
15:31:54.985385 IP 156.151.8.9.63013 > 10.196.108.178.ssh: Flags [P.], seq 3912:4112, ack 10337, win 258, length 200
15:31:54.985401 IP 10.196.108.178.ssh > 156.151.8.9.63013: Flags [.], ack 4112, win 409, length 0
15:31:54.985769 IP 10.196.108.178.ssh > 156.151.8.9.63013: Flags [P.], seq 10337:11217, ack 4112, win 409, length 880
15:31:55.428818 IP 156.151.8.9.63013 > 10.196.108.178.ssh: Flags [P.], seq 4112:4176, ack 11217, win 260, length 64
15:31:55.430951 IP 10.196.108.178.ssh > 156.151.8.9.63013: Flags [P.], seq 11217:11793, ack 4176, win 409, length 576
15:31:55.981310 IP 10.196.108.178.ssh > 156.151.8.5.53089: Flags [P.], seq 1840:1920, ack 1105, win 452, length 80
15:31:56.092802 IP 156.151.8.9.63013 > 10.196.108.178.ssh: Flags [.], ack 11793, win 260, length 0
15:31:56.290232 IP 156.151.8.9.63013 > 10.196.108.178.ssh: Flags [P.], seq 4176:4736, ack 11793, win 260, length 560
15:31:56.305144 IP 10.196.108.178.ssh > 156.151.8.9.63013: Flags [P.], seq 11793:12961, ack 4736, win 421, length 1168
15:31:56.487255 IP 156.151.8.5.53089 > 10.196.108.178.ssh: Flags [.], ack 1920, win 32759, length 0
15:31:56.487268 IP 156.151.8.5.53089 > 10.196.108.178.ssh: Flags [P.], seq 1105:1153, ack 1920, win 32759, length 48
15:31:56.487279 IP 10.196.108.178.ssh > 156.151.8.5.53089: Flags [.], ack 1153, win 452, length 0
15:31:56.911056 IP 156.151.8.9.63013 > 10.196.108.178.ssh: Flags [.], ack 12961, win 260, length 0
15:31:57.104353 IP 156.151.8.9.63013 > 10.196.108.178.ssh: Flags [P.], seq 4736:4784, ack 12961, win 260, length 48
15:31:57.144227 IP 10.196.108.178.ssh > 156.151.8.9.63013: Flags [.], ack 4784, win 421, length 0
15:32:03.977030 IP 10.196.108.178.ssh > 156.151.8.8.42430: Flags [P.], seq 1840:1920, ack 1105, win 387, length 80
15:32:04.603408 IP 156.151.8.8.42430 > 10.196.108.178.ssh: Flags [.], ack 1920, win 32758, length 0
15:32:04.967923 IP 156.151.8.8.42430 > 10.196.108.178.ssh: Flags [P.], seq 1105:1153, ack 1920, win 32758, length 48
15:32:04.967949 IP 10.196.108.178.ssh > 156.151.8.8.42430: Flags [.], ack 1153, win 387, length 0
15:32:05.963593 IP 10.196.108.178.ssh > 156.151.8.14.48339: Flags [P.], seq 3840:3920, ack 2609, win 907, length 80
15:32:06.371145 IP 156.151.8.14.48339 > 10.196.108.178.ssh: Flags [P.], seq 2609:2657, ack 3920, win 258, length 48
15:32:06.371173 IP 10.196.108.178.ssh > 156.151.8.14.48339: Flags [.], ack 2657, win 907, length 0
15:32:11.474827 IP 156.151.8.9.63013 > 10.196.108.178.ssh: Flags [P.], seq 4784:4864, ack 12961, win 260, length 80
15:32:11.474855 IP 10.196.108.178.ssh > 156.151.8.9.63013: Flags [.], ack 4864, win 421, length 0
15:32:11.475402 IP 10.196.108.178.ssh > 156.151.8.9.63013: Flags [P.], seq 12961:13041, ack 4864, win 421, length 80
15:32:11.498303 IP 10.196.108.178.ssh > 156.151.8.5.53089: Flags [P.], seq 1920:2000, ack 1153, win 452, length 80
15:32:12.075583 IP 156.151.8.9.63013 > 10.196.108.178.ssh: Flags [.], ack 13041, win 260, length 0
15:32:12.089088 IP 156.151.8.5.53089 > 10.196.108.178.ssh: Flags [.], ack 2000, win 32758, length 0
15:32:12.467996 IP 156.151.8.5.53089 > 10.196.108.178.ssh: Flags [P.], seq 1153:1201, ack 2000, win 32758, length 48
15:32:12.468020 IP 10.196.108.178.ssh > 156.151.8.5.53089: Flags [.], ack 1201, win 452, length 0
15:32:12.737320 IP 156.151.8.9.63013 > 10.196.108.178.ssh: Flags [P.], seq 4864:4928, ack 13041, win 260, length 64
15:32:12.737926 IP 10.196.108.178.ssh > 156.151.8.9.63013: Flags [P.], seq 13041:13105, ack 4928, win 421, length 64
15:32:12.739840 IP 10.196.108.178.ssh > 156.151.8.9.63013: Flags [P.], seq 13105:13233, ack 4928, win 421, length 128
15:32:13.244869 IP 156.151.8.9.63013 > 10.196.108.178.ssh: Flags [.], ack 13233, win 259, length 0
15:32:14.152074 IP 156.151.8.9.63013 > 10.196.108.178.ssh: Flags [P.], seq 4928:4992, ack 13233, win 259, length 64
15:32:14.152259 IP 10.196.108.178.ssh > 156.151.8.9.63013: Flags [P.], seq 13233:13313, ack 4992, win 421, length 80
15:32:14.780647 IP 156.151.8.9.63013 > 10.196.108.178.ssh: Flags [P.], seq 4992:5056, ack 13313, win 259, length 64
15:32:14.780874 IP 10.196.108.178.ssh > 156.151.8.9.63013: Flags [P.], seq 13313:13393, ack 5056, win 421, length 80
15:32:15.247557 IP 156.151.8.9.63013 > 10.196.108.178.ssh: Flags [.], ack 13393, win 259, length 0
15:32:15.871459 IP 156.151.8.9.63013 > 10.196.108.178.ssh: Flags [P.], seq 5056:5120, ack 13393, win 259, length 64
15:32:15.871983 IP 10.196.108.178.ssh > 156.151.8.9.63013: Flags [P.], seq 13393:13457, ack 5120, win 421, length 64
15:32:15.873115 IP 10.196.108.178.ssh > 156.151.8.9.63013: Flags [P.], seq 13457:13537, ack 5120, win 421, length 80
15:32:15.873651 IP 10.196.108.178.ssh > 156.151.8.9.63013: Flags [P.], seq 13537:13665, ack 5120, win 421, length 128
15:32:16.523098 IP 156.151.8.9.63013 > 10.196.108.178.ssh: Flags [.], ack 13537, win 260, length 0
15:32:16.581474 IP 156.151.8.9.63013 > 10.196.108.178.ssh: Flags [.], ack 13665, win 260, length 0
15:32:19.982265 IP 10.196.108.178.ssh > 156.151.8.8.42430: Flags [P.], seq 1920:2000, ack 1153, win 387, length 80
15:32:20.464176 IP 156.151.8.8.42430 > 10.196.108.178.ssh: Flags [P.], seq 1153:1201, ack 2000, win 32768, length 48
15:32:20.464202 IP 10.196.108.178.ssh > 156.151.8.8.42430: Flags [.], ack 1201, win 387, length 0
15:32:20.974746 IP 156.151.8.14.48339 > 10.196.108.178.ssh: Flags [P.], seq 2657:2705, ack 3920, win 258, length 48
15:32:20.974777 IP 10.196.108.178.ssh > 156.151.8.14.48339: Flags [.], ack 2705, win 907, length 0
15:32:23.298691 IP 156.151.8.9.63013 > 10.196.108.178.ssh: Flags [P.], seq 5120:5168, ack 13665, win 260, length 48
15:32:23.338219 IP 10.196.108.178.ssh > 156.151.8.9.63013: Flags [.], ack 5168, win 421, length 0
15:32:27.483239 IP 10.196.108.178.ssh > 156.151.8.5.53089: Flags [P.], seq 2000:2080, ack 1201, win 452, length 80
15:32:28.155542 IP 156.151.8.5.53089 > 10.196.108.178.ssh: Flags [.], ack 2080, win 32768, length 0
15:32:28.468275 IP 156.151.8.5.53089 > 10.196.108.178.ssh: Flags [P.], seq 1201:1249, ack 2080, win 32768, length 48
15:32:28.468310 IP 10.196.108.178.ssh > 156.151.8.5.53089: Flags [.], ack 1249, win 452, length 0
